{
  "$schema": "https://json-schema.org/draft/2020-12/schema",
  "$id": "https://raw.githubusercontent.com/N123999/awesome-SpiritAgent/refs/heads/main/schemas/marketplace-entry.schema.json",
  "title": "Spirit Agent Marketplace Entry",
  "type": "object",
  "additionalProperties": false,
  "required": [
    "schemaVersion",
    "extensionId",
    "packageName",
    "status",
    "featured",
    "defaultVersion",
    "versions"
  ],
  "properties": {
    "$schema": {
      "type": "string"
    },
    "schemaVersion": {
      "type": "integer",
      "const": 1
    },
    "extensionId": {
      "type": "string",
      "minLength": 1,
      "pattern": "^[a-z0-9]+(?:[.-][a-z0-9]+)*\\.[a-z0-9]+(?:[.-][a-z0-9]+)*$"
    },
    "packageName": {
      "type": "string",
      "minLength": 1,
      "pattern": "^(?:@[a-z0-9-~][a-z0-9-._~]*\\/)?[a-z0-9-~][a-z0-9-._~]*$"
    },
    "status": {
      "type": "string",
      "enum": [
        "listed",
        "hidden",
        "deprecated",
        "blocked"
      ]
    },
    "featured": {
      "type": "boolean"
    },
    "defaultVersion": {
      "type": "string",
      "minLength": 1
    },
    "versions": {
      "type": "array",
      "minItems": 1,
      "items": {
        "type": "object",
        "additionalProperties": false,
        "required": [
          "version",
          "channel",
          "reviewStatus"
        ],
        "properties": {
          "version": {
            "type": "string",
            "minLength": 1
          },
          "channel": {
            "type": "string",
            "enum": [
              "stable",
              "preview",
              "experimental"
            ]
          },
          "reviewStatus": {
            "type": "string",
            "enum": [
              "unreviewed",
              "verified",
              "revoked"
            ]
          },
          "changelog": {
            "type": "object",
            "additionalProperties": false,
            "required": [
              "summary",
              "body"
            ],
            "properties": {
              "summary": {
                "type": "string",
                "minLength": 1
              },
              "body": {
                "type": "string",
                "minLength": 1
              }
            }
          }
        }
      }
    }
  }
}