{
  "$schema": "../../../schemas/marketplace-entry.schema.json",
  "schemaVersion": 1,
  "extensionId": "n123999.system-message-demo",
  "packageName": "@n123999/spirit-agent-extension-system-message-demo",
  "status": "listed",
  "featured": true,
  "defaultVersion": "0.1.0",
  "versions": [
    {
      "version": "0.1.0",
      "channel": "stable",
      "reviewStatus": "verified",
      "changelog": {
        "summary": "Initial public release.",
        "body": "- Initial public release.\n- Adds a minimal system-message demo extension."
      }
    }
  ]
}